<?xml version="1.0" encoding="utf-8" ?>
<?xml-stylesheet href="cv_greg.xsl" type="text/xsl" ?>

<!DOCTYPE cv SYSTEM "cv_greg.dtd"> 
<cv xmlns="http://www.w3schools.com"
	xmlns:xsi="http://www.w3.org/2001/XMLSchema-instance"
	xsi:schemaLocation="http://www.w3schools.com cv_greg.xsd">
	<lang>FR</lang>
	<general>
		<nom>Le Cun</nom>
		<prenom>Grégoire</prenom>
		<emploi_actuelle>Développeur Web Full-Stack</emploi_actuelle>
		<description>
			Passionné depuis <![CDATA[<span id="years-of-experience"></span>]]> ans, je parcours sans cesse les différents horizons que m’offre l’informatique tels que le mobile, les jeux vidéo ou encore le web.
			<![CDATA[<br/><br/>]]>
			Lorsqu’une idée d’application me vient en tête, je n’hésite jamais à la réaliser sur mon temps libre en me confrontant à une nouvelle technologie en vogue.
			<![CDATA[<br/><br/>]]>
			J’ai dans ma carrière, eu la chance de pouvoir assister à des conférences telles que Devoxx France ou Codeurs En Seine. Je me tiens également à jour en visionnant de moi-même des conférences en ligne ou en participant à des événements les soirs de semaine.
			<![CDATA[<br/><br/>]]>
			Je suis actuellement Développeur Full-Stack orienté Web avec un fort attrait pour les technologies Front-end. Je suis parfaitement capable de travailler en équipe dans un environnement agile et être force de proposition.
		</description>
		<adresse>Eaubonne, 95600</adresse>
		<telephone/>
		<url_site>http://glecun.fr</url_site>
		<email>gregoire.lecun@free.fr</email>
		<url_photo>http://glecun.fr/img/me2.jpg</url_photo>
	</general>
	<formations>
		<diplome>
			<nom>Diplôme d’ingénieur Informatique &amp; Réseaux</nom>
			<lieu_obtention>Université Paris 13, Ecole Sup’Galilée</lieu_obtention>
			<annee>2014 - 2017</annee>
			<description>Diplôme d’ingénieur en Informatique &amp; Réseaux en apprentissage réalisé en alternance à la Direction des Systèmes Informatiques de Foncia</description>
		</diplome>
		<diplome>
			<nom>DUT Informatique</nom>
			<lieu_obtention>Université Paris 13, IUT de Villetaneuse</lieu_obtention>
			<annee>2012 - 2014</annee>
			<description>DUT Informatique réalisé en alternance à la Direction des Systèmes Informatiques à Foncia.</description>
		</diplome>
	</formations>
	<realisations>
		<projet>
			<nom>ColorLine</nom>
			<lieu>Projet personnel</lieu>
			<date>
				<jour></jour>
				<mois></mois>
				<annee>2016 - 2017</annee>
			</date>
			<description>Jeu de reflexion pour Android réalisé avec Unity</description>
			<url_sources>https://play.google.com/store/apps/details?id=com.gle.colorline</url_sources>
		</projet>
		<projet>
			<nom>GlecunTech</nom>
			<lieu>Projet personnel</lieu>
			<date>
				<jour></jour>
				<mois></mois>
				<annee>2016</annee>
			</date>
			<description>Site web réalisé "from scratch" qui liste l'ensemble des technologies que j'utilise.</description>
			<url_sources>http://gregoire.lecun.free.fr/glecuntech/</url_sources>
		</projet>
		<projet>
			<nom>Site de Gîte/Chambres d'hôtes</nom>
			<lieu>Projet pour un client</lieu>
			<date>
				<jour></jour>
				<mois></mois>
				<annee>2014 - 2020</annee>
			</date>
			<description>Réalisation et maintenance d'un site vitrine réalisé avec Wordpress pour un domaine possédant des gîtes et des chambres d'hôtes</description>
		</projet>
		<projet>
			<nom>Jeu Space Invaders</nom>
			<lieu>Ecole Sup’Galilée</lieu>
			<date>
				<jour></jour>
				<mois></mois>
				<annee>2015</annee>
			</date>
			<description>Jeu réalisé en Java graphique dans le cadre de ma formation d'ingénieur Informatique &amp; Réseaux.</description>
			<url_sources>http://glecun.fr/#projects</url_sources>
		</projet>
		<projet>
			<nom>Jeux Pygame</nom>
			<lieu>Projet personnel</lieu>
			<date>
				<jour>01</jour>
				<mois>Mars</mois>
				<annee>2013</annee>
			</date>
			<description>Jeux réalisés en Python orienté objet avec la librairie graphique Pygame par envie personnel.</description>		
			<url_sources>http://glecun.fr/#projects</url_sources>
		</projet>
	</realisations>
	<experiences>
		<experience>
			<nom_poste>Développeur Web Full-Stack</nom_poste>
			<nom_entreprise>VIDAL</nom_entreprise>
			<periode>
				<date>
					<jour></jour>
					<mois/>
					<annee>2017</annee>
				</date>
				<date>
					<jour></jour>
					<mois/>
					<annee>aujourd'hui</annee>
				</date>
			</periode>
			<description>
				Développement d'applications Web Java / Angular à destination des scientifiques, des laboratoires et des éditeurs de VIDAL. J'ai agis au sein d'une DSI très sensible à l'agilité avec une réelle intention de toujours s'améliorer.
				Mon travail a été : analyse technique et conception, estimations des solutions, développements et tests (TDD / Pair Programming)
				<![CDATA[<br/><br/>]]>
				Environnement technique : Java 8 - 10, Angular 7, AngularJs, Jasmine, Hibernate, Spring, JUnit / Mockito / Cucumber, MongoDB, Maven, Git, Sonar
			</description>
		</experience>
		<experience>
			<nom_poste>Développeur Web Java</nom_poste>
			<nom_entreprise>Foncia Groupe</nom_entreprise>
			<periode>
				<date>
					<jour></jour>
					<mois/>
					<annee>2014</annee>
				</date>
				<date>
					<jour></jour>
					<mois/>
					<annee>2017</annee>
				</date>
			</periode>
			<description>Branchement d’un moteur de recherche ElasticSearch sur une application web réalisée avec la technologie JSF2 en Java et opération de maintenance évolutive et corrective des applications de Foncia essentiellement sur le domaine de la prospection.</description>
		</experience>
		<experience>
			<nom_poste>Administrateur Système &amp; Développeur Web PHP</nom_poste>
			<nom_entreprise>Foncia Groupe</nom_entreprise>
			<periode>
				<date>
					<jour></jour>
					<mois/>
					<annee>2012</annee>
				</date>
				<date>
					<jour></jour>
					<mois/>
					<annee>2014</annee>
				</date>
			</periode>
			<description>Lors de ma première année à Foncia, occupation d’un poste d'Administrateur Système pour la mise en place des automatismes de création d'environnement dans le Cloud. La solution devait fournir aux développeurs un environnement de recette comprenant plusieurs services (Apache, Tomcat, FTP, SQL, etc...). Puis la seconde année, intégration de l'équipe de développeur PHP pour le développement d'une application réalisée avec la technologie Symfony2 et opérer de la maintenance évolutive et corrective des applications de Foncia.</description>
		</experience>
	</experiences>
	<competences>
		<groupe>
			<nom>Languages / Frameworks</nom>
			<competence><nom>Java</nom><bold>true</bold></competence>
			<competence><nom>Angular</nom><bold>true</bold></competence>
			<competence><nom>Html / CSS</nom></competence>
			<competence><nom>AngularJs</nom></competence>
			<competence><nom>React</nom></competence>
		</groupe>
		<groupe>
			<nom>Tests</nom>
			<competence><nom>JUnit</nom><bold>true</bold></competence>
			<competence><nom>AssertJ</nom><bold>true</bold></competence>
			<competence><nom>Mockito</nom><bold>true</bold></competence>
			<competence><nom>Jasmine</nom></competence>
			<competence><nom>Jest</nom><bold>true</bold></competence>
			<competence><nom>Cucumber</nom></competence>
		</groupe>
		<groupe>
			<nom>Bases de Données</nom>
			<competence><nom>MongoDb</nom><bold>true</bold></competence>
			<competence><nom>PostgreSQL</nom><bold>true</bold></competence>
			<competence><nom>SQL Server</nom></competence>
		</groupe>
		<groupe>
			<nom>Outils</nom>
			<competence><nom>Intellij</nom><bold>true</bold></competence>
			<competence><nom>Git</nom><bold>true</bold></competence>
			<competence><nom>Docker</nom></competence>
			<competence><nom>Gradle</nom></competence>
			<competence><nom>Maven</nom></competence>
			<competence><nom>Jenkins</nom></competence>
			<competence><nom>Npm</nom></competence>
			<competence><nom>RabbitMQ</nom></competence>
		</groupe>
		<groupe>
			<nom>Software Craftsmanship</nom>
			<competence><nom>TDD</nom><bold>true</bold></competence>
			<competence><nom>Pair Programming</nom><bold>true</bold></competence>
			<competence><nom>Scrum</nom></competence>
			<competence><nom>Kanban</nom></competence>
			<competence><nom>Mob Programming</nom></competence>
		</groupe>
		<groupe>
			<nom>Connaissances non avancées</nom>
			<competence><nom>Vue.js</nom></competence>
			<competence><nom>Wordpress</nom></competence>
			<competence><nom>VertX</nom></competence>
			<competence><nom>ElasticSearch</nom></competence>
			<competence><nom>Symfony2</nom></competence>
		</groupe>
		<groupe>
			<nom>Jeux Vidéo</nom>
			<competence><nom>Unity</nom></competence>
			<competence><nom>Game Maker studio 2</nom></competence>
		</groupe>
	</competences>
	<autres>
		<langues>
			<langue>
				<nom>Anglais</nom>
				<niveau>(TOEIC: 830pts)</niveau>
			</langue>
		</langues>
		<hobbies>
			<hobbie>
				<nom>Jeux vidéo</nom>
				<niveau/>
				<icon>gamepad</icon>
			</hobbie>
			<hobbie>
				<nom>Jeux de société</nom>
				<niveau/>
				<icon>dice</icon>
			</hobbie>
			<hobbie>
				<nom>Guitare-Basse/Guitare</nom>
				<niveau/>
				<icon>music</icon>
			</hobbie>
			<hobbie>
				<nom>Salle de sport</nom>
				<niveau/>
				<icon>dumbbell</icon>
			</hobbie>
		</hobbies>
	</autres>
</cv>
